{"bindings":{"abi_revision":"1.0","artifact_sha256":null,"core_revision":"sha256:6370b1a71ff2637c941288a9480770d0d9d1cba9c8e786ef7b34d752ab807a73","grammar_sha256":"7243c0125d933573dbd726ae11944fb8e32e34741111954b6be884d52ad60bd2","hotset_sha256":"5a485a23624cd284aaa27e55dadc1a130fde3e560f491b6585ba6cf079d50824","profile_generator":"tools/compile_capability.py@0.1","prompt_sha256":"c739512e57078cf49ca9b00951c21a10dfc8d98c85070f5f09c31ede4f4045d9","registry_sha256":"39830e91c12c2a189334110d14579b1fde6992149e5b3354ca84d79373269936","tool_schema_sha256":"a36847e0591bcb16227de8aa911e282cbd71c1d9928624403c2bddcadaa88c42"},"device_budget":{"artifact_bytes_max":131072,"imports_max":0,"resident_bytes_max":null,"scratch_bytes_max":null,"target_profile":"no-import-wasm"},"domain":"statistics","evidence":{"benchmark_mapping":null,"benchmark_mapping_sha256":null,"conformance_sha256":null,"conformance_suite":null,"model_result_bundles":[],"qualification_records":[]},"format":"exactscope.capability.profile","format_version":"0.1-draft","model_budget":{"generated_request_tokens_max":256,"grammar_bytes_max":4096,"normal_model_turns_max":1,"plan_steps_max":8,"prompt_fragment_bytes_max":1024,"request_bytes_max":512,"schema_bytes_max":4096,"semantic_operation_count":8},"notes":"Experimental Statistics source profile. Compiler derives bindings; model and target evidence are separate gates.","profile_id":"statistics-core-8-ai","profile_revision":6,"runtime_surface":{"model_visible_tools_max":2,"normal_model_turns_max":1,"xs_calc":{"enabled":true,"plan_revision":"plan-v0.1"},"xs_eval":{"operations":["stats.corr.pearson","stats.mean","stats.mean.weighted","stats.sd.pop","stats.sd.sample","stats.sum","stats.var.pop","stats.var.sample"]},"xs_find":{"enabled":false}},"support":"experimental","task_families":["descriptive-aggregation","pearson-correlation","variance-standard-deviation-method-selection","weighted-mean"]}
